author,book,original,adapted
Грин,Алые паруса,Артур Грэй был рожден в знатной семье аристократов.,Артур Грэй родился в богатой семье аристократов.
Грин,Алые паруса,"Он родился капитаном, хотел быть им и стал им.",Он всегда хотел быть капитаном и стал им.
Грин,Алые паруса,"Огромный дом, в котором родился Грэй, был мрачным внутри и величественным снаружи замком. ","Огромный дом, в котором родился Грэй, был настоящим замком."
Грин,Алые паруса,К переднему фасаду примыкали цветник и часть парка.,"Около замка был цветник, росли старые деревья, протекал ручей."
Грин,Алые паруса,"Грэй неутомимо изучал замок, делая поразительные открытия.","С раннего детства Грэй изучал замок, делая удивительные открытия."
Грин,Алые паруса,Мать Грея обажала своего сына всем сердцем.,Мать Грея очень любила своего сына.
Грин,Алые паруса,"Лилиан Грэй, оставаясь наедине с мальчиком, делалась простой мамой.","Лилиан Грэй, оставаясь вдвоем с мальчиком, делалась простой мамой."
Грин,Алые паруса,Она решительно не могла в чем бы то ни было отказать сыну.,Она не могла ни в чем отказать сыну.
Грин,Алые паруса,"Он мог ездить на любой лошади, брать в замок любую собаку; рыться в библиотеке, бегать босиком и есть, что ему вздумается.","Он мог ездить на любой лошади, брать в замок любую собаку, бегать босиком и есть, что ему только захочется."
Грин,Алые паруса,"Его отец некоторое время боролся с этим, но уступил - не принципу, а желанию жены.","Его отец некоторое время боролся с этим, но потом перестал."
Грин,Алые паруса,"В общем, он был всепоглощенно занят бесчисленными фамильными процессами, начало которых терялось в эпохе возникновения бумажных фабрик, а конец - в смерти всех кляузников, что сына он видел так редко, что иногда забывал, сколько ему лет.","В общем, он был занят государственными делами, сына он видел так редко, что иногда забывал, сколько ему лет."
Грин,Алые паруса,"Таким образом, Грэй жил в своем мире.","Таким образом, Грэй жил в своем мире."
Грин,Алые паруса,"Он играл один - обыкновенно на задних дворах замка, имевших в старину боевое значение.",Он играл один обычно на задних дворах замка. 
Грин,Алые паруса,"Темные ряды книжных шкафов были набиты грудами книг, чертежами и таблицами, рядами новых изданий, картами; разнообразием переплетов, грубых, нежных, черных, пестрых, синих, серых, толстых, тонких, шершавых и гладких.","В высоких темных шкафах было много книг, здесь были еще чертежи и таблицы, карты."
Грин,Алые паруса,"Огромный глобус, заключенный в медный сферический крест экватора и меридиана, стоял на круглом столе.",Огромный глобус стоял на круглом столе.
Грин,Алые паруса,"Обернувшись к выходу, Грэй увидел над дверью огромную картину, сразу содержанием своим наполнившую душное оцепенение библиотеки.","Обернувшись к выходу, Грэй увидел над дверью огромную картину."
Грин,Алые паруса,"Картина изображала корабль, вздымающийся на гребень морского вала.",На картине был изображен корабль.
Грин,Алые паруса,Корабль шел прямо на зрителя.,Корабль шел прямо на зрителя.
Грин,Алые паруса,"Но всего замечательнее была в этой картине фигура человека, стоящего на баке спиной к зрителю.","Но самым интересным в этой картине была фигура человека, который стоял спиной к зрителю."
Грин,Алые паруса,Богатство костюма выказывало в нем капитана корабля.,Это был капитан корабля.
Грин,Алые паруса,Грэй несколько раз приходил смотреть эту картину.,Грэй несколько раз приходил смотреть эту картину.
Грин,Алые паруса,В маленьком мальчике постепенно укладывалось огромное море,В голове маленького мальчика постепенно появлялось огромное море.
Грин,Алые паруса,"Он сжился с ним, роясь в библиотеке, выискивая и жадно читая те книги, за золотой дверью которых открывалось синее сияние океана.","Он искал в библиотеке и читал те книги, в которых ему открывался синий океан."
Грин,Алые паруса,"Там, сея за кормой пену, двигались корабли.",Там двигались корабли.
Грин,Алые паруса,"Часть их теряла паруса, мачты и, захлебываясь волной, опускалась в тьму пучин, где мелькают фосфорические глаза рыб.","Одни из них теряли паруса, мачты и уходили под воду."
Грин,Алые паруса,Другие благополучно грузились в одном порту и выгружались в другом.,Другие спокойно грузили товар в одном порту и выгружались в другом.
Грин,Алые паруса,"Были там еще корабли-пираты, с черным флагом и страшной, размахивающей ножами командой; корабли-призраки, сияющие мертвенным светом синего озарения; военные корабли с солдатами, пушками и музыкой; корабли научных экспедиций, высматривающие вулканы, растения и животных.","Были там еще корабли-пираты, с черным флагом; военные корабли с солдатами, пушками и музыкой; корабли научных экспедиций, изучающая вулканы, растения и животных."
Грин,Алые паруса,"В этом мире, естественно, возвышалась над всем фигура капитана.",Но главной в этом мире была фигура капитана. 
Грин,Алые паруса,"Никакая профессия, кроме этой, не могла бы так удачно сплавить в одно целое все сокровища жизни, сохранив неприкосновенным тончайший узор каждого отдельного счастья.",Никакая другая профессия не интересовала Грея.
Грин,Алые паруса,Эта профессия сочетала в себе все.,В этой профессии было все. 
Грин,Алые паруса,"Опасность, риск, власть природы, свет далекой страны, чудесная неизвестность, мелькающая любовь, цветущая свиданием и разлукой; увлекательное кипение встреч, лиц, событий; безмерное разнообразие жизни.","Опасность, власть природы, свет далекой страны, увлекательные встречи, лица, события."
Грин,Алые паруса,"Осенью, на пятнадцатом году жизни, Артур Грэй тайно покинул дом и проник за золотые ворота моря.","Осенью, когда Артуру Грэю шел пятнадцатый год, он тайно уехал из дома. "
Грин,Алые паруса,"В скорости из порта Дубельт вышла в Марсель шкуна «Ансельм», увозя юнгу с маленькими руками и внешностью переодетой девочки.","Вскоре из порта Дубельт вышла в Марсель шхуна «Ансельм», увозя с собой юнгу. "
Грин,Алые паруса,"В течение года, пока «Ансельм» посещал Францию, Америку и Испанию, Грэй промотал часть своего имущества на пирожном, отдавая этим дань прошлому, а остальную часть - для настоящего и будущего - проиграл в карты.","В течение года, пока «Ансельм» посещал Францию, Америку и Испанию, Грэй истратил часть своих денег на пирожные, а остальную часть проиграл в карты."
Грин,Алые паруса,Он хотел быть дьявольским моряком.,Он хотел быть сильным моряком.
Грин,Алые паруса,"Он, задыхаясь, пил водку, а на купаньи, с замирающим сердцем, прыгал в воду головой вниз с двухсаженной высоты.","Он, задыхаясь, пил водку, прыгал в воду головой вниз с четырехметровой высоты."
Грин,Алые паруса,"Понемногу он потерял все, кроме главного - своей странной летящей души; он потерял слабость, став широк костью и крепок мускулами, бледность заменил темным загаром, изысканную беспечность движений отдал за уверенную меткость работающей руки, а в его думающих глазах отразился блеск, как у человека, смотрящего на огонь.","Постепенно у него окрепли мускулы, бледность заменил темный загар, руки стали сильными, а в глазах отразился блеск, как у человека, смотрящего на огонь."
Грин,Алые паруса,"И его речь, утратив неравномерную, надменно застенчивую текучесть, стала краткой и точной, как удар чайки в струю за трепетным серебром рыб.",Его речь стала краткой и точной.
Грин,Алые паруса,"Капитан «Ансельма» был добрый человек, но суровый моряк, взявший мальчика из некоего злорадства.","Капитан «Ансельма» был добрый человек, но суровый моряк."
Грин,Алые паруса,"В отчаянном желании Грэя он видел лишь эксцентрическую прихоть и заранее торжествовал, представляя, как месяца через два Грэй скажет ему, избегал смотреть в глаза: - «Капитан Гоп, я ободрал локти, ползая по снастям; у меня болят бока и спина, пальцы не разгибаются, голова трещит, а ноги трясутся. Все эти мокрые канаты в два пуда на весу рук; все эти леера, ванты, брашпили, тросы, стеньги и саллинги созданы на мучение моему нежному телу. Я хочу к маме».","Когда он брал мальчика на шхуну, он представлял себе, как месяца через два Грэй скажет ему: - «Капитан Гоп, у меня болят бока и спина, пальцы ничего не чувствуют, а ноги трясутся. Я хочу к маме»."
Грин,Алые паруса,"Между тем внушительный диалог приходил на ум капитану все реже и реже, так как Грэй шел к цели с стиснутыми зубами и побледневшим лицом.","Но такая мысль приходила на ум капитану все реже и реже, так как Грэй шел к цели очень решительно. "
Грин,Алые паруса,"Грею шел уже двенадцатый год, когда все намеки его души, все разрозненные черты духа и оттенки тайных порывов соединились в одном сильном моменте и тем получив стройное выражение стали неукротимым желанием. Это случилось в библиотеке.","Грею шел уже двенадцатый год, когда он впервые попал в домашнюю библиотеку."
Грин,Алые паруса,"Этот юнга был Грэй, обладатель изящного саквояжа, тонких, как перчатка, лакированных сапожков и батистового белья с вытканными коронами.",Этот юнга был Грэй.
Тургенев,Ася,"Мне было тогда лет двадцать пять, - начал Н. Н., - дела давно минувших дней, как видите.","Мне было тогда лет двадцать пять, - начал Н. Н., - давно это было."
Тургенев,Ася,"Я только что вырвался на волю и уехал за границу, не для того, чтобы «окончить мое воспитание», 
как говаривалось тогда, а просто мне захотелось посмотреть на мир божий.","Я уехал за границу, я хотел посмотреть на мир."
Тургенев,Ася,"Я был здоров, молод, весел, деньги у меня не переводились, заботы еще не успели завестись - я жил без оглядки, 
делал что хотел, процветал, одним словом.","Я был здоров, молод, весел, деньги у меня были - я делал, что хотел."
Тургенев,Ася,"Я путешествовал без всякой цели, без плана; останавливался везде, где мне нравилось, и отправлялся тотчас далее, как только чувствовал желание видеть новые лица - именно лица.","Я путешествовал без цели, без плана; останавливался везде, где мне нравилось, и уезжал, как только чувствовал желание видеть новые лица - именно лица. "
Тургенев,Ася,"Меня занимали исключительно одни люди; я ненавидел любопытные памятники, замечательные собрания, один вид лон-лакея возбуждал во мне ощущение тоски и злобы.",Меня интересовали только люди; я ненавидел памятники.
Тургенев,Ася,"Итак, лет двадцать тому назад я проживал в немецком небольшом городке З., на левом берегу Рейна.","Итак, лет двадцать назад я жил в немецком небольшом городке З., на левом берегу Рейна."
Тургенев,Ася,"Городок этот мне понравился своим местоположением у подошвы двух высоких холмов, своими дряхлыми стенами и башнями, вековыми липами, крутым мостом над светлой речкой, впадавшей в Рейн, - а главное, своим хорошим вином.","Городок этот мне понравился своими древними стенами и башнями, старыми липами, мостом над речкой, которая впадала в Рейн, - а главное, своим хорошим вином."
Тургенев,Ася,"По его узким улицам гуляли вечером, тотчас после захождения солнца (дело было в июне), прехорошенькие белокурые немочки и, встретясь с иностранцем, произносили приятным голоском: «Guten Abend!».","По его узким улицам гуляли вечером очень хорошенькие немки и, встретясь с иностранцем, они говорили приятным голосом: «Guten Abend!»."
Тургенев,Ася,Городок З. лежит в двух верстах от Рейна.,Городок З. находится недалеко от Рейна.
Тургенев,Ася,"Я часто ходил смотреть на величавую реку и, не без некоторого напряжения мечтая о коварной вдове, просиживал долгие часы на каменной скамье под одиноким огромным ясенем.",Я часто ходил смотреть на эту реку и долгие часы сидел на каменной скамье под одиноким огромным деревом.
Тургенев,Ася,"Маленькая статуя мадонны с почти детским лицом и красным сердцем на груди, пронзенным мечами, печально выглядывала из его ветвей.",Маленькая статуя мадонны с почти детским лицом и красным сердцем на груди печально смотрела из его ветвей.
Тургенев,Ася,"На противоположном берегу находился городок Л., немного побольше того, в котором я поселился.","На другом берегу находился городок Л., он был немного побольше города З."
Тургенев,Ася,"Однажды вечером сидел я на своей любимой скамье и глядел то на реку, то на небо, то на виноградники.","Однажды вечером сидел я на своей любимой скамье и глядел то на реку, то на небо, то на виноградники."
Тургенев,Ася,Внезапно послышались звуки музыки.,Вдруг я услышал звуки музыки.
Тургенев,Ася,В городе Л. играли вальс.,В городе Л. играли вальс.
Гончаров,Обломов,"В Гороховой улице, в одном из больших домов, народонаселения которого стало бы на целый уездный город, лежал утром в постели, на своей квартире, Илья Ильич Обломов.","На Гороховой улице, в одном из больших домов лежал утром в постели Илья Ильич Обломов."
Гончаров,Обломов,"Это был человек лет тридцати двух-трех от роду, среднего роста, приятной наружности, с темно-серыми глазами, но с отсутствием всякой определенной идеи, всякой сосредоточенности в 
чертах лица.","Это был человек лет тридцати двух-трех, среднего роста, приятной внешности, с темно-серыми глазами. "
Гончаров,Обломов,"Но ни усталость, ни скука не могли ни на минуту согнать с лица мягкость, которая была господствующим и основным выражением, не лица только, а всей души; а душа так открыто и ясно светилась в глазах, в улыбке, в каждом движении головы, руки.","Его лицо выражало мягкость, а душа так открыто и ясно светилась в глазах, в улыбке, в каждом движении головы, руки."
Гончаров,Обломов,"На нем был халат из персидской материи, настоящий восточный халат, без малейшего намека на Европу, без кистей, без бархата, без талии, весьма поместительный, так что и Обломов мог дважды завернуться в него. ","На нем был широкий халат из персидской материи, настоящий восточный 
халат."
Гончаров,Обломов,"Лежанье у Ильи Ильича не было ни необходимостью, как у больного или как у человека, который хочет спать, ни случайностью, как у того, кто устал, ни наслаждением, как у лентяя: это было 
его нормальным состоянием.",Лежание у Ильи Ильича было его нормальным состоянием.
Гончаров,Обломов,"Когда он был дома - а он был почти всегда дома, - он все лежал, и все постоянно в одной комнате, где мы его нашли, служившей ему спальней, кабинетом и приемной.","Когда он был дома - а он был почти всегда дома, - он все лежал, и все постоянно в одной комнате."
Гончаров,Обломов,"У него было еще три комнаты, но он редко туда заглядывал, утром разве, и то не всякий день, когда человек мел кабинет его, чего всякий день не делалось.","У него было еще три комнаты, но он редко туда заглядывал."
Гончаров,Обломов,"В тех комнатах мебель закрыта была чехлами, шторы спущены.","В тех комнатах мебель закрыта была чехлами, шторы спущены."
