author,book,original,adapted
Куприн,Олеся,"— Нет... не можно... слышите, какая завируха.","— Нет… нельзя… слышите, какой ветер."
Куприн,Олеся,Заяц теперь лежит и — а ни мур-мур... ,Заяц теперь лежит…
Куприн,Олеся,Завтра и одного следа не увидите.,Завтра ни одного следа не увидите.
Куприн,Олеся,"Судьба забросила меня на целых шесть месяцев в глухую деревушку Волынской губернии, на окраину Полесья, и охота была единственным моим занятием и удовольствием.","Я поехал на шесть месяцев в дальнюю деревню Волынской губернии, в Полесье, и охота была единственным моим занятием и удовольствием."
Куприн,Олеся,"А я в то время (рассказывать, так все рассказывать) уж успел тиснуть в одной маленькой газетке рассказ с двумя убийствами и одним самоубийством и знал теоретически, что для писателей полезно наблюдать нравы.","Я в то время уже успел напечатать в одной маленькой газете рассказ о двух убийствах и одном самоубийстве и знал теоретически, что для писателей полезно наблюдать за людьми."
Куприн,Олеся,"Книжки, какие у меня были, я все очень скоро перечитал.","Книги, которые у меня были, я все очень скоро перечитал."
Куприн,Олеся,Времени у меня было полным полно.,Времени свободного у меня было много.
Куприн,Олеся,Мне оставалось только на охоту ходить с удовольствием.,И я с удовольствием ходил на охоту.
Куприн,Олеся,"Но в конце января наступила такая погода, что и охотиться стало невозможно.","Но в конце января наступила такая погода, что и охотиться стало невозможно."
Куприн,Олеся,"Каждый день дул страшный ветер, а за ночь на снегу образовывался твердый, льдистый слой наста, по которому заяц пробегал, не оставляя следов. ","Каждый день дул страшный ветер, а за ночь на снегу образовывался твердый слой льда, по которому заяц пробегал, не оставляя следов."
Куприн,Олеся,"Сидя взаперти и прислушиваясь к вою ветра, я тосковал страшно.","Сидя дома и прислушиваясь к вою ветра, я очень тосковал. "
Куприн,Олеся,"Ярмола сидел на корточках перед заслонкой, перемешивая в печке уголья, а я ходил взад и вперед по диагонали моей комнаты.","Ярмола сидел перед печкой и перемешивал уголь, а я ходил взад и вперед по диагонали моей комнаты."
Куприн,Белый пудель,"Узкими горными тропинками, от одного дачного поселка до другого, пробиралась вдоль южного берега Крыма маленькая бродячая труппа.",Вдоль южного берега Крыма по узким горным дорогам шла маленькая бродячая труппа.
Куприн,Белый пудель,"Впереди обыкновенно бежал, свесив набок длинный розовый язык, белый пудель Арто, остриженный наподобие льва.","Впереди обычно бежал белый пудель Арто, постриженный как лев."
Куприн,Белый пудель,"За собакой шел двенадцатилетний мальчик Сергей, который держал под левым локтем свернутый ковер для акробатических упражнений, а в правой нес тесную и грязную клетку со щеглом, обученным вытаскивать из ящика разноцветные бумажки с предсказаниями на будущую жизнь.","За собакой шел двенадцатилетний мальчик Сергей, который держал под левым локтем свернутый ковер для акробатических упражнений, а в правой нес клетку с щеглом, обученным доставать из ящика разноцветные бумажки с предсказаниями на будущую жизнь."
Куприн,Белый пудель,"Наконец сзади плелся старший член труппы — дедушка Мартын Лодыжкин, с шарманкой на скрюченной спине.","Наконец сзади шёл старший в труппе — дедушка Мартын Лодыжкин, с шарманкой на спине."
Куприн,Белый пудель,"Шарманка была старинная, страдавшая хрипотой, кашлем и перенесшая на своем веку не один десяток починок.",Шарманка была старинная.
Куприн,Белый пудель,"Играла она две вещи: унылый немецкий вальс Лаунера и галоп из «Путешествия в Китай» — обе бывшие в моде лет тридцать — сорок тому назад, но теперь всеми позабытые.","Играла она две вещи: немецкий вальс Лаунера и галоп из «Путешествий в Китай», они были в моде лет тридцать-сорок тому назад, а теперь всеми забытые."
Куприн,Белый пудель,"Дедушка Мартын Лодыжкин любил свою шарманку так, как можно любить только живое, близкое, пожалуй даже родственное существо. ","Дедушка Мартын Лодыжкин любил свою шарманку так, как можно любить только живое и близкое существо."
Куприн,Белый пудель,"Столько же, сколько шарманку, может быть даже немного больше, он любил своих младших спутников в вечных скитаниях: пуделя Арто и маленького Сергея.","Так же, как шарманку, может быть, даже немного больше, он любил пуделя Арто и маленького Сергея."
Куприн,Белый пудель,"Мальчика он взял пять лет тому назад «напрокат» у забулдыги, вдового сапожника, обязавшись за это уплачивать по два рубля в месяц.","Мальчика он взял пять лет тому назад у пьяницы сапожника, обещав за это платить ему по два рубля в месяц."
Куприн,Белый пудель,"Но сапожник вскоре умер, и Сергей остался навеки связанным с дедушкой и душою и мелкими житейскими интересами.","Но сапожник вскоре умер, и Сергей остался навсегда с дедушкой."
Куприн,Белый пудель,"Тропинка шла вдоль высокого прибрежного обрыва, извиваясь в тени столетних маслин. ",Дорожка шла вдоль высокого берега.
Куприн,Белый пудель,"Море иногда мелькало между деревьями, и тогда казалось, что, уходя вдаль, оно в то же время подымается вверх спокойной могучей стеной, и цвет его был еще синее, еще гуще в узорчатых прорезах, среди серебристо-зеленой листвы.",Между деревьями было видно море.
Куприн,Белый пудель,"День выдался знойный, безветренный, и накалившаяся земля жгла подошвы ног.","День был жаркий, безветренный, и нагревшаяся земля жгла подошвы ног."
Куприн,Белый пудель,Сергей шел по обыкновению.,Сергей шёл как всегда.
Чехов,Шуточка,"Ясный, зимний полдень...","Ясный, зимний полдень..."
Чехов,Шуточка,"Мороз крепок, трещит, и у Наденьки, которая держит меня под руку, покрываются серебристым инеем кудри на висках и пушок над верхней губой.","Сильный мороз, и у Наденьки покрываются серебристым инеем кудри на висках."
Чехов,Шуточка,Мы стоим на высокой горе.,"Мы стоим на высокой горе, она держит меня под руку."
Чехов,Шуточка,"Возле нас маленькие санки, обитые ярко-красным сукном.",Возле нас маленькие санки.
Чехов,Шуточка,"— Съедемте вниз, Надежда Петровна! — умоляю я.","— Поехали вниз, Надежда Петровна! — прошу я."
Чехов,Шуточка,— Один только раз!,— Один только раз!
Чехов,Шуточка,Но Наденька боится.,Но Наденька боится.
Чехов,Шуточка,"У нее замирает дух и прерывается дыхание, когда она глядит вниз, когда я только предлагаю сесть в санки, но что же будет, если она рискнет полететь в пропасть!","У неё останавливается дыхание, когда она глядит вниз, когда я только предлагаю сесть в санки."
Чехов,Шуточка,— Умоляю вас! — говорю я.,— Умоляю Вас! — говорю я.
Чехов,Шуточка,— Не надо бояться!,— Не надо бояться!
Чехов,Шуточка,"Поймите же, это малодушие, трусость!","Поймите же, это трусость!"
Чехов,Шуточка,"Наденька наконец уступает, и я по лицу вижу, что она уступает с опасностью для жизни.","Наденька наконец уступает, и я по лицу вижу, что она уступает с опасностью для жизни."
Чехов,Шуточка,"Я сажаю ее, бледную, дрожащую, в санки, обхватываю рукой и вместе с нею низвергаюсь в бездну.","Я сажаю её, бледную, дрожащую, в санки, обхватываю рукой и мы летим вниз."
Чехов,Шуточка,Санки летят как пуля.,Санки летят как пуля.
Чехов,Шуточка,От напора ветра нет сил дышать.,От сильного ветра трудно дышать.
Чехов,Шуточка,"Кажется, сам дьявол обхватил нас лапами и с ревом тащит в ад.","Кажется, сам дьявол обхватил нас лапами и тащит в ад…"
Чехов,Шуточка,"Вот-вот еще мгновение, и кажется — мы погибнем!","Вот-вот ещё мгновение, и кажется — мы погибнем!"
Чехов,Шуточка,"— Я люблю вас, Надя! — говорю я вполголоса.","— Я люблю Вас, Надя! — говорю я тихо."
Чехов,Шуточка,"Санки начинают бежать всё тише и тише, рев ветра и жужжанье полозьев не так уже страшны, дыхание перестает замирать, и мы наконец внизу.","Санки начинают бежать всё тише и тише, шум ветра уже не так страшен, и мы наконец внизу."
Чехов,Шуточка,"Наденька бледна, едва дышит...","Наденька бледна, еле дышит..."
Чехов,Шуточка,Я помогаю ей подняться.,Я помогаю ей подняться.
Чехов,Шуточка,"— Ни за что в другой раз не поеду, — говорит она, глядя на меня широкими, полными ужаса глазами.","Ни за что в другой раз не поеду, — говорит она, глядя на меня испуганными глазами."
Чехов,Шуточка,— Ни за что на свете!,— Ни за что!
Чехов,Шуточка,Я едва не умерла!,Я чуть не умерла!
Чехов,Радость,Было двенадцать часов ночи.,Было двенадцать часов ночи.
Чехов,Радость,"Митя Кулдаров, возбужденный, взъерошенный, влетел в квартиру своих родителей и быстро заходил по всем комнатам.","Митя Кулдаров, взволнованный, вбежал в квартиру своих родителей и быстро заходил по всем комнатам. "
Чехов,Радость,Родители уже ложились спать.,Родители уже ложились спать.
Чехов,Радость,Сестра лежала в постели и дочитывала последнюю страничку романа.,Сестра лежала в постели и дочитывала последнюю страничку романа.
Чехов,Радость,Братья-гимназисты спали.,Братья-гимназисты спали.
Чехов,Радость,— Откуда ты? — удивились родители.,— Откуда ты? — удивились родители.
Чехов,Радость,— Что с тобой?,— Что с тобой?
Чехов,Радость,"— Ох, не спрашивайте!","— Ох, не спрашивайте!"
Чехов,Радость,Я никак не ожидал!,Я никак не ожидал!
Чехов,Радость,"Нет, я никак не ожидал!","Нет, я никак не ожидал!"
Чехов,Радость,Это… это даже невероятно! ,Это… это даже невероятно! 
Чехов,Радость,"Митя захохотал и сел в кресло, будучи не в силах держаться на ногах от счастья.","Митя засмеялся и сел в кресло, у него не было сил стоять от счастья."
Чехов,Радость,— Это невероятно! Вы не можете себе представить!,— Это невероятно!
Чехов,Радость,Вы поглядите! ,Вы поглядите! 
Чехов,Радость,"Сестра спрыгнула с постели и, накинув на себя одеяло, подошла к брату.","Сестра спрыгнула с постели и, накинув на себя одеяло, подошла к брату."
Чехов,Радость,Гимназисты проснулись.,Гимназисты проснулись.
Чехов,Радость,— Что с тобой? ,— Что с тобой?
Чехов,Радость,На тебе лица нет!,Ты такой бледный!
Чехов,Радость,"— Это я от радости, мамаша!","— Это я от радости, мамаша!"
Чехов,Радость,Ведь теперь меня знает вся Россия!,Ведь теперь меня знает вся Россия!
Чехов,Радость,Вся!,Вся!
Чехов,Радость,"Раньше только вы одни знали, что на этом свете существует коллежский регистратор Дмитрий Кулдаров, а теперь вся Россия знает об этом!","Раньше только вы одни знали, что на этом свете существует коллежский регистратор Дмитрий Кулдаров, а теперь вся Россия знает об этом!"
Чехов,Радость,"Мамаша! О, господи!",Мамаша!
Чехов,Радость,"Митя вскочил, побегал по всем комнатам и опять сел.","Митя вскочил, побегал по всем комнатам и опять сел."
Чехов,Радость,— Да что такое случилось?,— Да что такое случилось?
Чехов,Радость,Говори!,Говори!
Чехов,Радость,"— Вы живете, как дикие звери, газет не читаете, не обращаете никакого внимания на гласность, а в газетах так много замечательного!","— Вы живете, как дикие звери, газет не читаете, а в газетах так много интересного!"
Чехов,Радость,"Ежели что случится, сейчас всё известно, ничего не укроется!","Если что-то случится, сейчас же всё известно!"
Чехов,Радость,Как я счастлив!,Как я счастлив!
Чехов,Радость,"О, господи!","О, господи!"
Чехов,Радость,"Ведь только про знаменитых людей в газетах печатают, а тут взяли да про меня напечатали!","Ведь только про знаменитых людей в газетах печатают, а тут про меня напечатали!"
Чехов,Радость,— Что ты?,— Что ты?
Чехов,Радость,Где?,Где?
Чехов,"Ах, зубы!","У Сергея Алексеича Дыбкина, любителя сценических искусств, болят зубы.","У Сергея Алексеевича Дыбкина, любителя театральных спектаклей, болят зубы."
Чехов,"Ах, зубы!","По мнению опытных дам и московских зубных врачей, зубная боль бывает трех сортов: ревматическая, нервная и костоедная; но взгляните вы на физиономию несчастного Дыбкина, и вам ясно станет, что его боль не подходит ни к одному из этих сортов.",Взгляните вы на лицо несчастного Дыбкина.
Чехов,"Ах, зубы!","Кажется, сам чёрт с чертенятами засел в его зуб и работает там когтями, зубами и рогами.","Кажется, сам черт засел в его зуб и работает там когтями, зубами и рогами."
Чехов,"Ах, зубы!","У бедняги Дыбкина лопается голова, сверлит в ухе, зеленеет в глазах, царапает в носу.", У бедного Дыбкина болит голова и ухо.
Чехов,"Ах, зубы!","Он держится обеими руками за правую щеку, бегает из угла в угол и орет благим матом...","Он держится обеими руками за правую щеку, бегает из угла в угол..."
Чехов,"Ах, зубы!","— Да помогите же мне! — кричит он, топая ногами.","— Да помогите же мне! — кричит он, топая ногами."
Чехов,"Ах, зубы!","— Застрелюсь, чёрт вас возьми!",— Застрелюсь!
Чехов,"Ах, зубы!", Повешусь!,Повешусь!
Чехов,"Ах, зубы!","Кухарка советует ему пополоскать зубы водкой, мамаша — приложить к щеке тертого хрена с керосином; сестра рекомендует одеколон, смешанный с чернилами, тетенька вымазала ему десны йодом... ","Кухарка советует ему прополоскать зубы водкой, мамаша — приложить к щеке тертого хрена с керосином; сестра рекомендует одеколон, смешанный с чернилами, тётенька намазала ему десны йодом…"
Чехов,"Ах, зубы!","Но от всех этих средств он провонял лекарствами, поглупел и стал орать еще громче...","Но от всех этих средств он пропах лекарствами, поглупел и стал кричать еще громче…"
Чехов,"Ах, зубы!","Остается одно только неиспробованное средство — пустить себе пулю в лоб или, выпивши залпом три бутылки коньяку, обалдеть и завалиться спать...",Остаётся одно только средство — застрелиться или выпить сразу три бутылки коньяку и лечь спать…
Чехов,"Ах, зубы!","Но вот наконец находится умный человек, который советует Дыбкину съездить на Тверскую, в дом Загвоздкина, где живет зубной врач Каркман, рвущий зубы моментально, без боли и дешево — по своей цене.","Но вот наконец появился умный человек, который посоветовал Дыбкину съездить на Тверскую, где живёт зубной врач Каркман, рвущий зубы быстро, без боли и дёшево."
Чехов,"Ах, зубы!","Дыбкин хватается за эту идею, как пьяный купец за перила, одевает пальто и мчится на извозчике по данному адресу.",Дыбкин надевает пальто и мчится на извозчике по этому адресу.
Чехов,"Ах, зубы!","Вот, наконец, вывеска: «Зубной врач Я. А. Каркман».","Вот, наконец, вывеска: «Зубной врач Я.А.Каркман»."
Чехов,"Ах, зубы!",Дыбкин прыгает с извозчика и с воплем взбегает наверх по каменной лестнице.,Дыбкин прыгает с извозчика и с криком взбегает наверх по каменной лестнице.
Чехов,"Ах, зубы!","Давит он пуговку звонка с таким остервенением, что ломает свой изящный ноготь.","Давит он пуговку звонка с такой силой, что ломает свой красивый ноготь."
Чехов,"Ах, зубы!",— Дома?,— Дома?
Чехов,"Ах, зубы!",Принимает? — спрашивает он горничную.,Принимает? — спрашивает он горничную.
Чехов,"Ах, зубы!","— Пожалуйста, принимают...","— Входите, пожалуйста, принимает…"
