author,book,original,adapted
Борода,На том же месте,Сейчас тихо.,Сейчас тихо.
Борода,На том же месте,А в рабочие дни тракторы и самосвалы не прекращают шуметь.,А в рабочие дни тракторы и самосвалы не прекращают шуметь.
Борода,На том же месте,И пыли от них так много! ,И пыли от них так много! 
Борода,На том же месте,Даже на вишне и персиках пыль.,Даже на вишне и персиках пыль.
Борода,На том же месте,"Точно, персики!","Точно, персики!"
Борода,На том же месте,Здесь персики росли самые вкусные в мире!,Здесь персики росли самые вкусные в мире!
Борода,На том же месте,"Розовые, жёлтые, красные, оранжевые, сочные, с тонкой кожицей и крупной шершавой косточкой!","Розовые, жёлтые, красные, оранжевые, сочные, с тонкой кожицей и крупной шершавой косточкой!"
Борода,На том же месте,"Димка с Ромой с удовольствием ели их за завтраком, обедом и ужином.","Дима с Ромой с удовольствием ели их за завтраком, обедом и ужином."
Борода,На том же месте,"Они, кажется, одними персиками питались.",Они почти одними персиками питались.
Борода,На том же месте,"А когда они проезжали на машине мимо фруктовых садов, персики весело мелькали между листьев и казались желтыми мячиками.","Когда они проезжали на машине мимо фруктовых садов, персики мелькали между листьев и казались желтыми мячиками."
Борода,На том же месте,И становилось радостно.,И становилось радостно.
Борода,На том же месте,"Это что, теперь такого не будет?","Это что, теперь такого не будет?"
Борода,На том же месте,Неспокойно было у Димки на душе. За обедом он почти ничего не ел.,У Димы было неспокойно на душе. За обедом он почти ничего не ел.
Борода,На том же месте,Думал о речке и о персиках.,Он думал о реке и о персиках.
Борода,На том же месте,Пообедав все стали собираться по своими делам.,После обеда все стали собираться по своими делам.
Борода,На том же месте,"— Я погоду смотреть, — сказал папа.","— Я посмотрю погоду, — сказал папа."
Борода,На том же месте,Это значит — смотреть в планшете прогноз погоды.,Это значит — смотреть в планшете прогноз погоды.
Борода,На том же месте,"А заодно новости и другие занимательные вещи, которые можно найти в интернете.","А заодно новости и другие интересные вещи, которые можно найти в интернете."
Борода,На том же месте,"— Я на речку, — сообщил Димка.","— Я пойду на реку, — сказал Дима."
Борода,На том же месте,"— Я к черепахам, — заявил Рома.","— Я пойду к черепахам, — сказал Рома."
Борода,На том же месте,"— Только после того, как помоешь посуду, — сказала мама папе.","— Только после того, как помоешь посуду, — сказала мама папе."
Борода,На том же месте,"— Не стой долго в холодной воде, — напомнила она Димке. ","— Не стой долго в холодной воде, — напомнила она Димке. "
Борода,На том же месте,— И не забудь надеть кепку.,— И кепку надень.
Борода,На том же месте,Роме ничего не сказала.,Роме она ничего не сказала.
Борода,На том же месте,"Ванна с домашними черепахами стояла неподалеку, можно бы ло ви деть, что он там делает и чем собирается их кормить.","Ванна с домашними черепахами стояла недалеко, можно бы ло ви деть, что он там делает и чем собирается их кормить."
Борода,На том же месте,Димка надел кепку и побежал к речке.,Дима надел кепку и побежал к речке.
Борода,На том же месте,Громадные глиняные кучи лежали по берегам.,Глиняные кучи лежали по берегам.
Борода,На том же месте,Димка немножко походил вдоль берега речки.,Дима немножко походил вдоль берега речки.
Борода,На том же месте,"Перешёл на другую сторону, походил там.",Он перешёл на другую сторону и походил там.
Зощенко,Елка,"В этом году мне исполнилось, ребята, сорок лет.","В этом году мне исполнилось, ребята, сорок лет."
Зощенко,Елка,"Значит, выходит, что я сорок раз видел новогоднюю ёлку.","Это значит, что я сорок раз видел новогоднюю ёлку."
Зощенко,Елка,Это много!,Это много!
Зощенко,Елка,"Ну, первые три года жизни и, наверное, не понимал, что такое ёлка.","Ну, первые три года жизни я, наверное, не понимал, что такое ёлка."
Зощенко,Елка,"Наверное, мама выносила меня на ручках.","Наверное, мама выносила меня на руках."
Зощенко,Елка,"И, наверное, я своими чёрными глазёнками без интереса смотрел на разукрашенное дерево.","И, наверное, я своими чёрными глазами без интереса смотрел на разукрашенное дерево."
Зощенко,Елка,"А когда мне, дети, ударило пять лет, то я уже отлично понимал, что такое ёлка.","А когда мне, дети, исполнилось пять лет, то я уже отлично понимал, что такое ёлка. "
Зощенко,Елка,И я с нетерпением ожидал этого весёлого праздника.,И я с нетерпением ожидал этого весёлого праздника.
Зощенко,Елка,"И даже в щёлочку двери подглядывал, как моя мама украшает ёлку.","И даже в дверь подглядывал, как моя мама украшает ёлку."
Зощенко,Елка,А моей сестрёнке Лёле было в то время семь лет.,А моей сестрёнке Лёле было в то время семь лет. 
Зощенко,Елка,И она была исключительно бойкая девочка.,И она была очень бойкая девочка.
Зощенко,Елка,"Она мне однажды сказала:— Минька, мама ушла на кухню. ","Она мне однажды сказала: — Минька, мама ушла на кухню."
Зощенко,Елка,"Давай пойдём в комнату, где стоит ёлка, и поглядим, что там делается.","Давай пойдём в комнату, где стоит ёлка, и посмотрим, что там делается."
Зощенко,Елка,Вот мы с сестрёнкой Лелей вошли в комнату.,Вот мы с сестрой Лелей вошли в комнату.
Зощенко,Елка,И видим: очень красивая ёлка.,И видим: очень красивая ёлка.
Зощенко,Елка,А под ёлкой лежат подарки.,А под ёлкой лежат подарки.
Зощенко,Елка,"А на ёлке разноцветные бусы, флаги, фонарики, золотые орехи, пастилки и крымские яблочки.","А на ёлке разноцветные бусы, флаги, фонарики, золотые орехи, пастилки и крымские яблочки."
Зощенко,Не надо врать,Я учился очень давно.,Я учился очень давно.
Зощенко,Не надо врать,И учителя тогда ставили в дневнике отметки за каждый спрошенный урок.,И учителя тогда ставили в дневнике отметки за каждый урок.
Зощенко,Не надо врать,Они ставили какой-нибудь балл — от пятерки до единицы включительно.,Они ставили какой-нибудь балл — от пятёрки до единицы включительно.
Зощенко,Не надо врать,"А я был очень маленький, когда поступил в гимназию, в приготовительный класс.","А я был очень маленький, когда поступил в гимназию, в подготовительный класс."
Зощенко,Не надо врать,Мне было всего семь лет.,Мне было всего семь лет.
Зощенко,Не надо врать,"И я ничего еще не знал, что бывает в гимназиях. ","И я ничего ещё не знал, что бывает в гимназиях."
Зощенко,Не надо врать,"И вот однажды учитель велел нам выучить наизусть стихотворение: Весело сияет месяц над селом, Белый снег сверкает синим огоньком…","И вот однажды учитель сказал, чтобы мы выучили наизусть стихотворение: Весело сияет месяц над селом, Белый снег сверкает синим огоньком…"
Зощенко,Не надо врать,А я этого стихотворения не выучил.,А я это стихотворение не выучил.
Зощенко,Не надо врать,"Я не слышал, что сказал учитель.","Я не слышал, что сказал учитель."
Зощенко,Не надо врать,"Я не слышал потому, что мальчики, которые сидели позади, то шлепали меня книгой по затылку, то мазали мне ухо чернилами, то дергали меня за волосы, и когда я от неожиданности вскакивал — подкладывали под меня карандаш или вставочку.","Я не слышал потому, что мальчики, которые сидели сзади, то ударяли меня книгой по затылку, то мазали мне ухо чернилами, то дергали меня за волосы и, когда я от неожиданности вскакивал — подкладывали под меня карандаш."
Зощенко,Не надо врать,"А на другой день учитель, как назло, вызвал меня и велел прочитать наизусть заданное стихотворение.","А на другой день учитель вызвал меня и сказал, чтобы я прочитал наизусть заданное стихотворение."
Зощенко,Не надо врать,"А я не только не знал его, но даже и не подозревал, что на свете есть такие стихотворения.","А я не знал его и даже и не подозревал, что на свете есть такие стихотворения."
Зощенко,Не надо врать,"Но от робости я не посмел сказать учителю, что не знаю этих стихов.","Но я не решился сказать учителю, что не знаю этих стихов."
Зощенко,Не надо врать,"И совершенно ошеломленный стоял за своей партой, не произнося ни слова.","Испуганный я стоял за своей партой, не говоря ни слова."
Зощенко,Не надо врать,Но тут мальчишки стали подсказывать мне эти стихи.,Но тут мальчишки стали подсказывать мне эти стихи.
Зощенко,Не надо врать,"И благодаря этому я стал лепетать то, что они мне шептали.","И благодаря этому я стал говорить то, что они мне шептали."
Зощенко,Не надо врать,"А в то время у меня был хронический насморк, и я плохо слышал одним ухом и поэтому с трудом разбирал то, что они мне подсказывали.","А в это время у меня был насморк, и я плохо слышал одним ухом и поэтому с трудом понимал то, что они мне подсказывали."
Зощенко,Не надо врать,Еще первые строчки я кое-как произнес. ,Ещё первые строчки я кое-как проговорил.
Зощенко,Не надо врать,Но когда дело дошло до фразы: «Крест под облаками как свеча горит».,Но когда дело дошло до фразы: “Крест под облаками как свеча горит”.
Зощенко,Не надо врать,Я сказал: «Треск под сапогами как свеча болит».,Я сказал: “Треск под сапогами как свеча болит”.
Зощенко,Не надо врать,Тут раздался хохот среди учеников.,Тут все ученики засмеялись. 
Зощенко,Не надо врать,И учитель тоже засмеялся.,И учитель тоже засмеялся.
Зощенко,Не надо врать,"Он сказал:— А ну-ка, дай сюда свой дневник!",Он сказал: — Дай мне свой дневник!
Зощенко,Не надо врать,Я тебе туда единицу поставлю.,Я тебе единицу поставлю.
Зощенко,Не надо врать,"И я заплакал, потому что это была моя первая единица и я еще не знал, что за это бывает.","И я заплакал, потому что это была моя первая единица."
Зощенко,Не надо врать,"После уроков моя сестренка Леля зашла за мной, чтобы вместе идти домой.","После уроков моя сестрёнка Лёля зашла за мной, чтобы вместе идти домой."
Зощенко,Не надо врать,"По дороге я достал из ранца дневник, развернул его на той странице, где была поставлена единица, и сказал Леле: — Леля, погляди, что это такое?","По дороге я достал из ранца дневник, открыл его на той странице, где была поставлена единица, и сказал Лёле: — Лёля, погляди, что это такое?"
Зощенко,Не надо врать,Это мне учитель поставил за стихотворение «Весело сияет месяц над селом».,Это мне учитель поставил за стихотворение “Весело сияет месяц над селом”.
Акунин,Левиафан,"В Порт-Саиде на борт ""Левиафана"" поднялся новый пассажир, занявший номер восемнадцатый, последнюю вакантную каюту первого класса",В Порт-Саиде на «Левиафан» сел последний пассажир первого класса.
Акунин,Левиафан,У комиссара Гюстава Гоша сразу улучшилось настроение.,Настроение у комиссара Гоша стало лучше.
Акунин,Левиафан,"Он выглядел многообещающе: сдержанные и неторопливые движения, непроницаемое выражение красивого лица - на первый взгляд вроде бы совсем молодого, но когда объект снял котелок, неожиданно обнаружились виски с проседью.","Так... Спокоен, красив, кажется, очень молод, но есть седые волосы."
Акунин,Левиафан,"Сразу видно - с характером и, что называется, с прошлым, — подумал о нём Гош. ","С характером и с прошлым, — подумал о нём Гош. "
Акунин,Левиафан,"Пассажир шел по трапу, помахивая портпледом, а потные грузчики волокли изрядный багаж: дорогие скрипучие чемоданы, добротные саквояжи свиной кожи, объемистые связки с книгами и даже складной велосипед.","За пассажиром внесли багаж: дорогие чемоданы, большие сумки, книги, даже велосипед."
Акунин,Левиафан,"Сердце Гоша, старой ищейки, затрепетало от охотничьего азарта, когда у новенького не оказалось золотого значка - ни на шелковом лацкане щегольского летнего пальто, ни на пиджаке, ни на цепочке от часов.","«На пальто пассажира нет золотого значка! Хорошо! Похоже, это он!» — обрадовался Гош."
Акунин,Левиафан,"Впервые золотой значок Гош увидел на рю де Гренель, когда осматривал бренные останки лорда Литтлби.","Первый раз Гош увидел золотой значок на улице Гренель, когда осматривал спальню."
Акунин,Левиафан,Маленький золотой значок с буквами «JAP» был в руке Литтлби.,Маленький золотой значок с буквами «JAP» был в руке Литтлби.
Акунин,Левиафан,"Вечером того же дня комиссар выяснил, что в канун первого плавания ""Левиафана"" Лондонский монетный двор отчеканил золотые и серебряные памятные значки: золотые для пассажиров первого класса и старших офицеров судна, серебряные - для пассажиров второго класса и субалтернов.","Вечером того же дня комиссар узнал, что такие значки недавно сделаны для пассажиров нового большого корабля «Левиафан»: золотые — для пассажиров первого класса и старших офицеров, серебряные — для пассажиров второго класса."
Акунин,Левиафан,"Третий класс на роскошном корабле, где достижения современной техники сочетались с небывалым комфортом, не предусматривался вовсе.",А третьего класса на этом дорогом корабле просто не было.
Акунин,Левиафан,"Ещё Гош узнал, что 19 марта «Левиафан» уходит из Англии через Порт Саид, Суэцкий канал, Найден и Бомбей в Калькутту.","Ещё Гош узнал, что 19 марта «Левиафан» уходит из Англии через Порт Саид, Суэцкий канал, Найден и Бомбей в Калькутту."
Акунин,Левиафан,"Проще картофельного супа, — подумал комиссар Гош.","Задача нетрудная, — подумал комиссар Гош."
Акунин,Левиафан,"Надо подняться на пароход и посмотреть, у кого из пассажиров первого класса нет золотого значка.",Надо найти пассажира “Левиафана” без золотого значка. 
Акунин,Левиафан,"Убийцу будет ждать тюрьма, а меня — известность!","Убийцу будет ждать тюрьма, а меня — известность!"
Акунин,Левиафан,"Выяснилось, что на чертовом пароходище целых 132 пассажира и 10 старших офицеров.","Правда, в первом классе было 132 пассажира, а старших офицеров 10."
Акунин,Левиафан,"Все началось с того, что утром 19 марта пошёл дождь.","Все началось с того, что утром 19 марта пошёл дождь."
Акунин,Левиафан,"Нахохлившийся от сырого ветра, замотанный в теплое кашне комиссар стоял возле трапа, рядом с капитаном мистером Джосайей Клиффом и первым лейтенантом мсье Шарлем Ренье.","Капитан Клифф, его первый помощник лейтенант Шарль Ренье и комиссар Гош встречали пассажиров."
Акунин,Левиафан,Духовой оркестр попеременно играл английские и французские марши.,Играла музыка.
Акунин,Левиафан,"Гош пыхтел все яростней, грызя ни в чем не повинную трубку.","Гош курил, настроение у комиссара было ужасное."
Акунин,Левиафан,"Дождь ... увы - из-за холодной погоды все пассажиры были в плащах, пальто, шинелях, капотах.",Дождь... Все пассажиры в пальто.
Акунин,Левиафан,"Поди-ка разбери, у кого есть значок, а у кого нет?","Как узнать, у кого нет значка?"
Акунин,Левиафан,"Одно хорошо: все, кто должен был присоединиться в Саутгемптоне, оказались на месте и сели на корабль.",Одно хорошо: они сели на корабль.
